mysql> use kruszewskim
Reading table information for completion of table and column names
You can turn off this feature to get a quicker startup with -A

Database changed
mysql> desc statek;
+----------------+-----------------------------------------------------+------+-                                     ----+---------+-------+
| Field          | Type                                                | Null |                                      Key | Default | Extra |
+----------------+-----------------------------------------------------+------+-                                     ----+---------+-------+
| nazwa_statku   | int                                                 | NO   |                                      PRI | NULL    |       |
| rodzaj_statku  | enum('wojenne','pasazerskie','sportowe','handlowe') | YES  |                                          | NULL    |       |
| data_wodowania | date                                                | YES  |                                          | NULL    |       |
| max_ladownosc  | int unsigned                                        | YES  |                                          | NULL    |       |
+----------------+-----------------------------------------------------+------+-                                     ----+---------+-------+
4 rows in set (0.01 sec)

mysql> mysql> desc statek;
+----------------+-----------------------------------------------------+------+-----+---------+-------+
| Field          | Type                                                | Null | Key | Default | Extra |
+----------------+-----------------------------------------------------+------+-----+---------+-------+
| nazwa_statku   | int                                                 | NO   | PRI | NULL    |       |
| rodzaj_statku  | enum('wojenne','pasazerskie','sportowe','handlowe') | YES  |     | NULL    |       |
| data_wodowania | date                                                | YES  |     | NULL    |       |
| max_ladownosc  | int unsigned                                        | YES  |     | NULL    |       |
+----------------+-----------------------------------------------------+------+-----+---------+-------+
4 rows in set (0.00 sec)

mysql> select * from statek
    -> ;
+--------------+---------------+----------------+---------------+
| nazwa_statku | rodzaj_statku | data_wodowania | max_ladownosc |
+--------------+---------------+----------------+---------------+
|            1 | handlowe      | 1769-04-12     |          1600 |
|            2 | sportowe      | 1789-03-13     |          1000 |
+--------------+---------------+----------------+---------------+
2 rows in set (0.04 sec)

mysql> select * from postacie;
+------------+----------+---------+------------+------+
| id_postaci | nazwa    | rodzaj  | data_ur    | wiek |
+------------+----------+---------+------------+------+
|          1 | Bjorn    | wiking  | 1788-05-03 |   69 |
|          2 | Drozd    | ptak    | 1808-11-02 |   10 |
|          3 | Tesciowa | kobieta | 1754-07-12 |   88 |
|          4 | Prozd    | wiking  | 1785-12-17 |   67 |
|          5 | Gast     | wiking  | 1786-10-02 |   68 |
|          6 | Hal      | wiking  | 1790-04-25 |   71 |
|          7 | Kurn     | wiking  | 1784-06-12 |   66 |
|          8 | Mat      | wiking  | 1783-02-03 |   65 |
+------------+----------+---------+------------+------+
8 rows in set (0.00 sec)

mysql> ALTER TABLE postacie ADD COLUMN funkcja VARCHAR(40) AFTER rodzaj;
Query OK, 0 rows affected (0.19 sec)
Records: 0  Duplicates: 0  Warnings: 0

mysql> select * from postacie;
+------------+----------+---------+---------+------------+------+
| id_postaci | nazwa    | rodzaj  | funkcja | data_ur    | wiek |
+------------+----------+---------+---------+------------+------+
|          1 | Bjorn    | wiking  | NULL    | 1788-05-03 |   69 |
|          2 | Drozd    | ptak    | NULL    | 1808-11-02 |   10 |
|          3 | Tesciowa | kobieta | NULL    | 1754-07-12 |   88 |
|          4 | Prozd    | wiking  | NULL    | 1785-12-17 |   67 |
|          5 | Gast     | wiking  | NULL    | 1786-10-02 |   68 |
|          6 | Hal      | wiking  | NULL    | 1790-04-25 |   71 |
|          7 | Kurn     | wiking  | NULL    | 1784-06-12 |   66 |
|          8 | Mat      | wiking  | NULL    | 1783-02-03 |   65 |
+------------+----------+---------+---------+------------+------+
8 rows in set (0.00 sec)

mysql> UPDATE postacie SET funkcja = 'kapitan' WHERE id_postaci = 1;
Query OK, 1 row affected (0.00 sec)
Rows matched: 1  Changed: 1  Warnings: 0

mysql> select * from postacie
    -> ;
+------------+----------+---------+---------+------------+------+
| id_postaci | nazwa    | rodzaj  | funkcja | data_ur    | wiek |
+------------+----------+---------+---------+------------+------+
|          1 | Bjorn    | wiking  | kapitan | 1788-05-03 |   69 |
|          2 | Drozd    | ptak    | NULL    | 1808-11-02 |   10 |
|          3 | Tesciowa | kobieta | NULL    | 1754-07-12 |   88 |
|          4 | Prozd    | wiking  | NULL    | 1785-12-17 |   67 |
|          5 | Gast     | wiking  | NULL    | 1786-10-02 |   68 |
|          6 | Hal      | wiking  | NULL    | 1790-04-25 |   71 |
|          7 | Kurn     | wiking  | NULL    | 1784-06-12 |   66 |
|          8 | Mat      | wiking  | NULL    | 1783-02-03 |   65 |
+------------+----------+---------+---------+------------+------+
8 rows in set (0.00 sec)

mysql> ALTER TABLE postacie ADD COLUMN nazwa_statku VARCHAR(40);
Query OK, 0 rows affected (0.03 sec)
Records: 0  Duplicates: 0  Warnings: 0

mysql> ALTER TABLE postacie DROP COLUMN nazwa_statku;
Query OK, 0 rows affected (0.14 sec)
Records: 0  Duplicates: 0  Warnings: 0

mysql> select * from postacie;
+------------+----------+---------+---------+------------+------+
| id_postaci | nazwa    | rodzaj  | funkcja | data_ur    | wiek |
+------------+----------+---------+---------+------------+------+
|          1 | Bjorn    | wiking  | kapitan | 1788-05-03 |   69 |
|          2 | Drozd    | ptak    | NULL    | 1808-11-02 |   10 |
|          3 | Tesciowa | kobieta | NULL    | 1754-07-12 |   88 |
|          4 | Prozd    | wiking  | NULL    | 1785-12-17 |   67 |
|          5 | Gast     | wiking  | NULL    | 1786-10-02 |   68 |
|          6 | Hal      | wiking  | NULL    | 1790-04-25 |   71 |
|          7 | Kurn     | wiking  | NULL    | 1784-06-12 |   66 |
|          8 | Mat      | wiking  | NULL    | 1783-02-03 |   65 |
+------------+----------+---------+---------+------------+------+
8 rows in set (0.00 sec)

mysql> ALTER TABLE postacie ADD COLUMN statek VARCHAR(40) AFTER funkcja;
Query OK, 0 rows affected (0.08 sec)
Records: 0  Duplicates: 0  Warnings: 0

mysql> select * from postacie;
+------------+----------+---------+---------+--------+------------+------+
| id_postaci | nazwa    | rodzaj  | funkcja | statek | data_ur    | wiek |
+------------+----------+---------+---------+--------+------------+------+
|          1 | Bjorn    | wiking  | kapitan | NULL   | 1788-05-03 |   69 |
|          2 | Drozd    | ptak    | NULL    | NULL   | 1808-11-02 |   10 |
|          3 | Tesciowa | kobieta | NULL    | NULL   | 1754-07-12 |   88 |
|          4 | Prozd    | wiking  | NULL    | NULL   | 1785-12-17 |   67 |
|          5 | Gast     | wiking  | NULL    | NULL   | 1786-10-02 |   68 |
|          6 | Hal      | wiking  | NULL    | NULL   | 1790-04-25 |   71 |
|          7 | Kurn     | wiking  | NULL    | NULL   | 1784-06-12 |   66 |
|          8 | Mat      | wiking  | NULL    | NULL   | 1783-02-03 |   65 |
+------------+----------+---------+---------+--------+------------+------+
8 rows in set (0.00 sec)

mysql> ALTER TABLE postacie DROP COLUMN statek;
Query OK, 0 rows affected (0.05 sec)
Records: 0  Duplicates: 0  Warnings: 0


mysql> ALTER TABLE postacie DROP COLUMN stateK;
Query OK, 0 rows affected (0.07 sec)
Records: 0  Duplicates: 0  Warnings: 0


mysql> select * from postacie;
+------------+----------+---------+---------+------------+------+
| id_postaci | nazwa    | rodzaj  | funkcja | data_ur    | wiek |
+------------+----------+---------+---------+------------+------+
|          1 | Bjorn    | wiking  | kapitan | 1788-05-03 |   69 |
|          2 | Drozd    | ptak    | NULL    | 1808-11-02 |   10 |
|          3 | Tesciowa | kobieta | NULL    | 1754-07-12 |   88 |
|          4 | Prozd    | wiking  | NULL    | 1785-12-17 |   67 |
|          5 | Gast     | wiking  | NULL    | 1786-10-02 |   68 |
|          6 | Hal      | wiking  | NULL    | 1790-04-25 |   71 |
|          7 | Kurn     | wiking  | NULL    | 1784-06-12 |   66 |
|          8 | Mat      | wiking  | NULL    | 1783-02-03 |   65 |
+------------+----------+---------+---------+------------+------+
8 rows in set (0.00 sec)

mysql> ALTER TABLE postacie ADD COLUMN statek VARCHAR(40) AFTER funkcja;
Query OK, 0 rows affected (0.05 sec)
Records: 0  Duplicates: 0  Warnings: 0

mysql> ALTER TABLE postacie DROP COLUMN statek;
Query OK, 0 rows affected (0.08 sec)
Records: 0  Duplicates: 0  Warnings: 0

mysql> ALTER TABLE postacie ADD COLUMN statek_postaci VARCHAR(40) AFTER funkcja;
Query OK, 0 rows affected (0.05 sec)
Records: 0  Duplicates: 0  Warnings: 0

mysql> select * from postacie;
+------------+----------+---------+---------+----------------+------------+------+
| id_postaci | nazwa    | rodzaj  | funkcja | statek_postaci | data_ur    | wiek |
+------------+----------+---------+---------+----------------+------------+------+
|          1 | Bjorn    | wiking  | kapitan | NULL           | 1788-05-03 |   69 |
|          2 | Drozd    | ptak    | NULL    | NULL           | 1808-11-02 |   10 |
|          3 | Tesciowa | kobieta | NULL    | NULL           | 1754-07-12 |   88 |
|          4 | Prozd    | wiking  | NULL    | NULL           | 1785-12-17 |   67 |
|          5 | Gast     | wiking  | NULL    | NULL           | 1786-10-02 |   68 |
|          6 | Hal      | wiking  | NULL    | NULL           | 1790-04-25 |   71 |
|          7 | Kurn     | wiking  | NULL    | NULL           | 1784-06-12 |   66 |
|          8 | Mat      | wiking  | NULL    | NULL           | 1783-02-03 |   65 |
+------------+----------+---------+---------+----------------+------------+------+
8 rows in set (0.00 sec)

mysql> DESC postacie;
+----------------+---------------------------------+------+-----+---------+----------------+
| Field          | Type                            | Null | Key | Default | Extra          |
+----------------+---------------------------------+------+-----+---------+----------------+
| id_postaci     | int                             | NO   | PRI | NULL    | auto_increment |
| nazwa          | varchar(40)                     | YES  |     | NULL    |                |
| rodzaj         | enum('wiking','ptak','kobieta') | YES  |     | NULL    |                |
| funkcja        | varchar(40)                     | YES  |     | NULL    |                |
| statek_postaci | varchar(40)                     | YES  |     | NULL    |                |
| data_ur        | date                            | YES  |     | NULL    |                |
| wiek           | int unsigned                    | YES  |     | NULL    |                |
+----------------+---------------------------------+------+-----+---------+----------------+
7 rows in set (0.01 sec)

mysql> desc statek;
+----------------+-----------------------------------------------------+------+-----+---------+-------+
| Field          | Type                                                | Null | Key | Default | Extra |
+----------------+-----------------------------------------------------+------+-----+---------+-------+
| nazwa_statku   | int                                                 | NO   | PRI | NULL    |       |
| rodzaj_statku  | enum('wojenne','pasazerskie','sportowe','handlowe') | YES  |     | NULL    |       |
| data_wodowania | date                                                | YES  |     | NULL    |       |
| max_ladownosc  | int unsigned                                        | YES  |     | NULL    |       |
+----------------+-----------------------------------------------------+------+-----+---------+-------+
4 rows in set (0.00 sec)

mysql> ALTER TABLE statek CHANGE nazwa_statku nazwa_statku INT;
Query OK, 0 rows affected (0.01 sec)
Records: 0  Duplicates: 0  Warnings: 0

mysql> ALTER TABLE statek CHANGE nazwa_statku nazwa_statku VARCHAR(40);
Query OK, 2 rows affected (0.11 sec)
Records: 2  Duplicates: 0  Warnings: 0

mysql> desc statek;
+----------------+-----------------------------------------------------+------+-----+---------+-------+
| Field          | Type                                                | Null | Key | Default | Extra |
+----------------+-----------------------------------------------------+------+-----+---------+-------+
| nazwa_statku   | varchar(40)                                         | NO   | PRI | NULL    |       |
| rodzaj_statku  | enum('wojenne','pasazerskie','sportowe','handlowe') | YES  |     | NULL    |       |
| data_wodowania | date                                                | YES  |     | NULL    |       |
| max_ladownosc  | int unsigned                                        | YES  |     | NULL    |       |
+----------------+-----------------------------------------------------+------+-----+---------+-------+
4 rows in set (0.00 sec)

mysql> ALTER TABLE postacie ADD CONSTRAINT FOREIGN KEY(statek_postaci) REFERENCES statek(nazwa_statku);
Query OK, 8 rows affected (0.21 sec)
Records: 8  Duplicates: 0  Warnings: 0

mysql> desc postacie;
+----------------+---------------------------------+------+-----+---------+----------------+
| Field          | Type                            | Null | Key | Default | Extra          |
+----------------+---------------------------------+------+-----+---------+----------------+
| id_postaci     | int                             | NO   | PRI | NULL    | auto_increment |
| nazwa          | varchar(40)                     | YES  |     | NULL    |                |
| rodzaj         | enum('wiking','ptak','kobieta') | YES  |     | NULL    |                |
| funkcja        | varchar(40)                     | YES  |     | NULL    |                |
| statek_postaci | varchar(40)                     | YES  | MUL | NULL    |                |
| data_ur        | date                            | YES  |     | NULL    |                |
| wiek           | int unsigned                    | YES  |     | NULL    |                |
+----------------+---------------------------------+------+-----+---------+----------------+
7 rows in set (0.03 sec)

mysql> select * from postacie
    -> ;
+------------+----------+---------+---------+----------------+------------+------+
| id_postaci | nazwa    | rodzaj  | funkcja | statek_postaci | data_ur    | wiek |
+------------+----------+---------+---------+----------------+------------+------+
|          1 | Bjorn    | wiking  | kapitan | NULL           | 1788-05-03 |   69 |
|          2 | Drozd    | ptak    | NULL    | NULL           | 1808-11-02 |   10 |
|          3 | Tesciowa | kobieta | NULL    | NULL           | 1754-07-12 |   88 |
|          4 | Prozd    | wiking  | NULL    | NULL           | 1785-12-17 |   67 |
|          5 | Gast     | wiking  | NULL    | NULL           | 1786-10-02 |   68 |
|          6 | Hal      | wiking  | NULL    | NULL           | 1790-04-25 |   71 |
|          7 | Kurn     | wiking  | NULL    | NULL           | 1784-06-12 |   66 |
|          8 | Mat      | wiking  | NULL    | NULL           | 1783-02-03 |   65 |
+------------+----------+---------+---------+----------------+------------+------+
8 rows in set (0.00 sec)

mysql> select * from statek;
+--------------+---------------+----------------+---------------+
| nazwa_statku | rodzaj_statku | data_wodowania | max_ladownosc |
+--------------+---------------+----------------+---------------+
| 1            | handlowe      | 1769-04-12     |          1600 |
| 2            | sportowe      | 1789-03-13     |          1000 |
+--------------+---------------+----------------+---------------+
2 rows in set (0.00 sec)

mysql> SET FOREIGN_KEY_CHECKS=0;
Query OK, 0 rows affected (0.00 sec)

mysql> UPDATE postacie SET statek_postaci = 'handlowe' WHERE id_postaci = 1;
Query OK, 1 row affected (0.00 sec)
Rows matched: 1  Changed: 1  Warnings: 0

mysql> select * from postacie;
+------------+----------+---------+---------+----------------+------------+------+
| id_postaci | nazwa    | rodzaj  | funkcja | statek_postaci | data_ur    | wiek |
+------------+----------+---------+---------+----------------+------------+------+
|          1 | Bjorn    | wiking  | kapitan | handlowe       | 1788-05-03 |   69 |
|          2 | Drozd    | ptak    | NULL    | NULL           | 1808-11-02 |   10 |
|          3 | Tesciowa | kobieta | NULL    | NULL           | 1754-07-12 |   88 |
|          4 | Prozd    | wiking  | NULL    | NULL           | 1785-12-17 |   67 |
|          5 | Gast     | wiking  | NULL    | NULL           | 1786-10-02 |   68 |
|          6 | Hal      | wiking  | NULL    | NULL           | 1790-04-25 |   71 |
|          7 | Kurn     | wiking  | NULL    | NULL           | 1784-06-12 |   66 |
|          8 | Mat      | wiking  | NULL    | NULL           | 1783-02-03 |   65 |
+------------+----------+---------+---------+----------------+------------+------+
8 rows in set (0.00 sec)

mysql> UPDATE postacie SET statek_postaci = 'handlowe' WHERE id_postaci = 2;
Query OK, 1 row affected (0.01 sec)
Rows matched: 1  Changed: 1  Warnings: 0

mysql> UPDATE postacie SET statek_postaci = 'handlowe' WHERE id_postaci = 4;
Query OK, 1 row affected (0.01 sec)
Rows matched: 1  Changed: 1  Warnings: 0

mysql> UPDATE postacie SET statek_postaci = 'handlowe' WHERE id_postaci = 5;
Query OK, 1 row affected (0.00 sec)
Rows matched: 1  Changed: 1  Warnings: 0

mysql> UPDATE postacie SET statek_postaci = 'handlowe' WHERE id_postaci = 6;
Query OK, 1 row affected (0.01 sec)
Rows matched: 1  Changed: 1  Warnings: 0

mysql> UPDATE postacie SET statek_postaci = 'handlowe' WHERE id_postaci = 7;
Query OK, 1 row affected (0.00 sec)
Rows matched: 1  Changed: 1  Warnings: 0

mysql> UPDATE postacie SET statek_postaci = 'handlowe' WHERE id_postaci = 8;
Query OK, 1 row affected (0.01 sec)
Rows matched: 1  Changed: 1  Warnings: 0

mysql> select * from postacie;
+------------+----------+---------+---------+----------------+------------+------+
| id_postaci | nazwa    | rodzaj  | funkcja | statek_postaci | data_ur    | wiek |
+------------+----------+---------+---------+----------------+------------+------+
|          1 | Bjorn    | wiking  | kapitan | handlowe       | 1788-05-03 |   69 |
|          2 | Drozd    | ptak    | NULL    | handlowe       | 1808-11-02 |   10 |
|          3 | Tesciowa | kobieta | NULL    | NULL           | 1754-07-12 |   88 |
|          4 | Prozd    | wiking  | NULL    | handlowe       | 1785-12-17 |   67 |
|          5 | Gast     | wiking  | NULL    | handlowe       | 1786-10-02 |   68 |
|          6 | Hal      | wiking  | NULL    | handlowe       | 1790-04-25 |   71 |
|          7 | Kurn     | wiking  | NULL    | handlowe       | 1784-06-12 |   66 |
|          8 | Mat      | wiking  | NULL    | handlowe       | 1783-02-03 |   65 |
+------------+----------+---------+---------+----------------+------------+------+
8 rows in set (0.00 sec)

mysql> select * from izba;
+---------------+------------+--------+------------+------------+
| adres_budynku | nazwa_izby | metraz | kolor_izby | wlasciciel |
+---------------+------------+--------+------------+------------+
| adres         | spizarnia  |   NULL | NULL       |       NULL |
+---------------+------------+--------+------------+------------+
1 row in set (0.00 sec)

mysql> DROP TABLE izba;
Query OK, 0 rows affected (0.02 sec)
